PS E:\Download\Lab 11-20250521> python nnet_optimization.py
[I 2025-05-21 16:30:09,611] A new study created in memory with name: CNN Optimizer
[I 2025-05-21 16:35:38,528] Trial 0 finished with value: 0.02225 and parameters: {'n_conv_layers': 1, 'conv_l0_out_channels': 64, 'conv_l0_kernel_size': 3, 'conv_l0_pool_type': 'max', 'conv_l0_pool_kernel_size': 3, 'n_fc_layers': 2, 'fc_l0_hidden_size': 106, 'fc_l1_hidden_size': 98, 'dropout_rate': 0.3100504951924189, 'learn_rate': 0.00027935176959446075, 'optimizer': 'Adam', 'batch_size': 128, 'num_epochs': 6}. Best is trial 0 with value: 0.02225.
[I 2025-05-21 16:40:23,036] Trial 1 finished with value: 0.0275 and parameters: {'n_conv_layers': 1, 'conv_l0_out_channels': 64, 'conv_l0_kernel_size': 3, 'conv_l0_pool_type': 'max', 'conv_l0_pool_kernel_size': 2, 'n_fc_layers': 2, 'fc_l0_hidden_size': 120, 'fc_l1_hidden_size': 71, 'dropout_rate': 0.23971171019743054, 'learn_rate': 0.05001121777849928, 'optimizer': 'SGD', 'batch_size': 128, 'num_epochs': 6}. Best is trial 0 with value: 0.02225.
[I 2025-05-21 16:44:31,299] Trial 2 finished with value: 0.153 and parameters: {'n_conv_layers': 3, 'conv_l0_out_channels': 32, 'conv_l0_kernel_size': 3, 'conv_l0_pool_type': 'none', 'conv_l1_out_channels': 32, 'conv_l1_kernel_size': 3, 'conv_l1_pool_type': 'max', 'conv_l1_pool_kernel_size': 3, 'conv_l2_out_channels': 32, 'conv_l2_kernel_size': 5, 'conv_l2_pool_type': 'max', 'conv_l2_pool_kernel_size': 3, 'n_fc_layers': 2, 'fc_l0_hidden_size': 119, 'fc_l1_hidden_size': 46, 'dropout_rate': 0.2557066595886276, 'learn_rate': 0.010541778487401189, 'optimizer': 'SGD', 'batch_size': 128, 'num_epochs': 4}. Best is trial 0 with value: 0.02225.
[I 2025-05-21 16:54:15,343] Trial 3 finished with value: 0.031083333333333334 and parameters: {'n_conv_layers': 2, 'conv_l0_out_channels': 32, 'conv_l0_kernel_size': 3, 'conv_l0_pool_type': 'none', 'conv_l1_out_channels': 64, 'conv_l1_kernel_size': 5, 'conv_l1_pool_type': 'max', 'conv_l1_pool_kernel_size': 2, 'n_fc_layers': 1, 'fc_l0_hidden_size': 40, 'dropout_rate': 0.4987455657506574, 'learn_rate': 0.013161035024257521, 'optimizer': 'SGD', 'batch_size': 64, 'num_epochs': 5}. Best is trial 0 with value: 0.02225.
[I 2025-05-21 16:59:12,417] Trial 4 finished with value: 0.9101666666666667 and parameters: {'n_conv_layers': 3, 'conv_l0_out_channels': 64, 'conv_l0_kernel_size': 5, 'conv_l0_pool_type': 'avg', 'conv_l0_pool_kernel_size': 2, 'conv_l1_out_channels': 16, 'conv_l1_kernel_size': 5, 'conv_l1_pool_type': 'avg', 'conv_l1_pool_kernel_size': 3, 'conv_l2_out_channels': 32, 'conv_l2_kernel_size': 5, 'conv_l2_pool_type': 'none', 'n_fc_layers': 1, 'fc_l0_hidden_size': 82, 'dropout_rate': 0.1702799085527762, 'learn_rate': 0.00010468640452581278, 'optimizer': 'SGD', 'batch_size': 128, 'num_epochs': 6}. Best is trial 0 with value: 0.02225.        
[I 2025-05-21 17:01:25,450] Trial 5 finished with value: 0.8966666666666666 and parameters: {'n_conv_layers': 3, 'conv_l0_out_channels': 16, 'conv_l0_kernel_size': 3, 'conv_l0_pool_type': 'avg', 'conv_l0_pool_kernel_size': 3, 'conv_l1_out_channels': 32, 'conv_l1_kernel_size': 3, 'conv_l1_pool_type': 'avg', 'conv_l1_pool_kernel_size': 3, 'conv_l2_out_channels': 16, 'conv_l2_kernel_size': 5, 'conv_l2_pool_type': 'avg', 'conv_l2_pool_kernel_size': 2, 'n_fc_layers': 1, 'fc_l0_hidden_size': 123, 'dropout_rate': 0.2922703635404347, 'learn_rate': 0.05813569353790862, 'optimizer': 'Adam', 'batch_size': 32, 'num_epochs': 5}. Best is trial 0 with value: 0.02225.
[I 2025-05-21 17:03:59,710] Trial 6 finished with value: 0.0295 and parameters: {'n_conv_layers': 3, 'conv_l0_out_channels': 64, 'conv_l0_kernel_size': 3, 'conv_l0_pool_type': 'avg', 'conv_l0_pool_kernel_size': 2, 'conv_l1_out_channels': 32, 'conv_l1_kernel_size': 3, 'conv_l1_pool_type': 'none', 'conv_l2_out_channels': 32, 'conv_l2_kernel_size': 5, 'conv_l2_pool_type': 'none', 'n_fc_layers': 2, 'fc_l0_hidden_size': 96, 'fc_l1_hidden_size': 100, 'dropout_rate': 0.18842422947409865, 'learn_rate': 0.056935107469390595, 'optimizer': 'SGD', 'batch_size': 128, 'num_epochs': 3}. Best is trial 0 with value: 0.02225.
[I 2025-05-21 17:08:27,471] Trial 7 finished with value: 0.9030833333333333 and parameters: {'n_conv_layers': 2, 'conv_l0_out_channels': 64, 'conv_l0_kernel_size': 5, 'conv_l0_pool_type': 'avg', 'conv_l0_pool_kernel_size': 2, 'conv_l1_out_channels': 64, 'conv_l1_kernel_size': 5, 'conv_l1_pool_type': 'none', 'n_fc_layers': 1, 'fc_l0_hidden_size': 95, 'dropout_rate': 0.4990127307803187, 'learn_rate': 0.08069482133829183, 'optimizer': 'RMSprop', 'batch_size': 128, 'num_epochs': 4}. Best is trial 0 with value: 0.02225.
[I 2025-05-21 17:10:22,911] Trial 8 finished with value: 0.015583333333333333 and parameters: {'n_conv_layers': 1, 'conv_l0_out_channels': 32, 'conv_l0_kernel_size': 3, 'conv_l0_pool_type': 'max', 'conv_l0_pool_kernel_size': 3, 'n_fc_layers': 1, 'fc_l0_hidden_size': 43, 'dropout_rate': 0.10498852163993444, 'learn_rate': 0.0042787093367105235, 'optimizer': 'RMSprop', 'batch_size': 64, 'num_epochs': 5}. Best is trial 8 with value: 0.015583333333333333.
[I 2025-05-21 17:12:41,454] Trial 9 finished with value: 0.899 and parameters: {'n_conv_layers': 2, 'conv_l0_out_channels': 32, 'conv_l0_kernel_size': 5, 'conv_l0_pool_type': 'max', 'conv_l0_pool_kernel_size': 3, 'conv_l1_out_channels': 32, 'conv_l1_kernel_size': 3, 'conv_l1_pool_type': 'avg', 'conv_l1_pool_kernel_size': 3, 'n_fc_layers': 1, 'fc_l0_hidden_size': 115, 'dropout_rate': 0.2937154009988332, 'learn_rate': 0.052410129027662115, 'optimizer': 'Adam', 'batch_size': 128, 'num_epochs': 5}. Best is trial 8 with value: 0.015583333333333333.
Best trial for CNN:
   Value: 0.0156
   Params:
      n_conv_layers : 1
      conv_l0_out_channels : 32
      conv_l0_kernel_size : 3
      conv_l0_pool_type : max
      conv_l0_pool_kernel_size : 3
      n_fc_layers : 1
      fc_l0_hidden_size : 43
      dropout_rate : 0.10498852163993444
      learn_rate : 0.0042787093367105235
      optimizer : RMSprop
      batch_size : 64
      num_epochs : 5